{
  "$schema": "../schemas/recipe.schema.json",
  "id": "depth-graph",
  "primitive": "step-graph",
  "palette": "blood",
  "content": {
    "title": "DEPTH GRAPH",
    "eyebrow": "KODEX−∞ / PLATE KIT 005",
    "footer": "SYMBOLIC PLATE MARKING · NOT A SYSTEM MEASUREMENT"
  },
  "data": {
    "width": 179,
    "height": 115,
    "seed": 5,
    "n": 42,
    "trend": 0.85,
    "tooth": 0.16,
    "grid": [5, 4],
    "labelsX": ["−∞", "0", "+∞"],
    "labelsY": ["1.0", "0.5", "0.0"],
    "simbolico": true
  },
  "assetId": null
}
